{
  "schemaVersion": 1,
  "version": "2026.09.04",
  "denyByDefault": true,
  "safeMode": false,
  "constraints": [
    {
      "id": "signed-observability",
      "effect": "allow",
      "capabilities": ["ui.observability.black-box.sink"],
      "resources": ["afterburner.ui/envelopes/metadata"],
      "requireBuiltinSigned": true,
      "minimumRegistryEpoch": 1
    }
  ]
}
